date,renderedContent,user
2020-07-15 00:10:38+00:00,"Joe Biden claims to be prioritizing ‘safety of kids’ by keeping schools closed this Fall. Yet he remains silent about children being slaughtered by violence on the streets of Democrat run cities. You &amp; your children won’t be SAFE in Biden’s America, and neither will anyone else!",https://twitter.com/realDonaldTrump
2020-07-08 13:16:38+00:00,"In Germany, Denmark, Norway,  Sweden and many other countries, SCHOOLS ARE OPEN WITH NO PROBLEMS. The Dems think it would be bad for them politically if U.S. schools open before the November Election, but is important for the children &amp; families. May cut off funding if not open!",https://twitter.com/realDonaldTrump
2020-07-02 15:41:38+00:00,https://t.co/qC5qXAXBlm,https://twitter.com/realDonaldTrump
2020-06-27 13:23:56+00:00,"....Obamacare is a joke! Deductible is far too high and the overall cost is ridiculous. My Administration has gone out of its way to manage OC much better than previous, but it is still no good. I will ALWAYS PROTECT PEOPLE WITH PRE-EXISTING CONDITIONS, ALWAYS, ALWAYS,ALWAYS!!!",https://twitter.com/realDonaldTrump
2020-06-25 16:06:06+00:00,"The number of ChinaVirus cases goes up, because of GREAT TESTING, while the number of deaths (mortality rate), goes way down. The Fake News doesn’t like telling you that!",https://twitter.com/realDonaldTrump
2020-06-25 00:40:04+00:00,"Pres. Obama destroyed the lobster and fishing industry in Maine. Now it’s back, bigger and better than anyone ever thought possible. Enjoy your “lobstering” and fishing! Make lots of money!",https://twitter.com/realDonaldTrump
2020-06-24 22:10:48+00:00,"Biden failed with China. They took us to the cleaners! I got $Billions out of China, and gave much of it to our targeted farmers!",https://twitter.com/realDonaldTrump
2020-06-23 10:54:20+00:00,"Cases are going up in the U.S. because we are testing far more than any other country, and ever expanding. With smaller testing we would show fewer cases!",https://twitter.com/realDonaldTrump
2020-06-22 04:48:35+00:00,"Our Coronavirus testing is so much greater (25 million tests) and so much more advanced, that it makes us look like we have more cases, especially proportionally, than other countries. My message on that is very clear!",https://twitter.com/realDonaldTrump
2020-06-19 20:44:18+00:00,Joe Biden’s rally. ZERO enthusiasm! https://t.co/IB2BrrmTPH,https://twitter.com/realDonaldTrump
2020-06-19 14:25:09+00:00,Why are the Democrats allowed to make fake and fraudulent ads. They should be called out. They did nothing when they had the chance. I have done FAR more than any President in first 3 1/2 years!,https://twitter.com/realDonaldTrump
2020-06-18 12:43:04+00:00,"Biden got failing grades and polls on his clueless handling of the Swine Flu H1N1. It was a total disaster, they had no idea what they were doing. Among the worst ever!",https://twitter.com/realDonaldTrump
2020-06-18 00:00:32+00:00,Joe Biden was a TOTAL FAILURE in Government. He “bungled” everything that he touched!,https://twitter.com/realDonaldTrump
2020-06-15 14:14:26+00:00,"Our testing is so much bigger and more advanced than any other country (we have done a great job on this!) that it shows more cases. Without testing, or weak testing, we would be showing almost no cases. Testing is a double edged sword - Makes us look bad, but good to have!!!",https://twitter.com/realDonaldTrump
2020-06-15 14:14:26+00:00,"Our testing is so much bigger and more advanced than any other country (we have done a great job on this!) that it shows more cases. Without testing, or weak testing, we would be showing almost no cases. Testing is a double edged sword - Makes us look bad, but good to have!!!",https://twitter.com/realDonaldTrump
2020-06-15 14:02:15+00:00,"The Far Left Fake News Media, which had no Covid problem with the Rioters &amp; Looters destroying Democrat run cities, is trying to Covid Shame us on our big Rallies. Won’t work!",https://twitter.com/realDonaldTrump
2020-06-01 00:09:21+00:00,FAKE NEWS!,https://twitter.com/realDonaldTrump
2020-05-31 16:36:07+00:00,"The Lamestream Media is doing everything within their power to foment hatred and anarchy. As long as everybody understands what they are doing, that they are FAKE NEWS and truly bad people with a sick agenda, we can easily work through them to GREATNESS!",https://twitter.com/realDonaldTrump
2020-05-27 02:31:10+00:00,"The Failing @nytimes, winner of @PulitzerPrizes for its totally flawed coverage of the illegal Russia Witch Hunt, does its research as follows: Think of the absolute worst things you can say about Donald J. Trump, pretend there are sources, and just say it. RETURN THE PULITZERS!",https://twitter.com/realDonaldTrump
2020-05-25 12:12:07+00:00,"...full attendance in the Arena. In other words, we would be spending  millions of dollars building the Arena to a very high standard without even knowing if the Democrat Governor would allow the Republican Party to fully occupy the space. Plans are being....",https://twitter.com/realDonaldTrump
2020-05-23 22:59:02+00:00,TRANSITION TO GREATNESS!,https://twitter.com/realDonaldTrump
2020-05-21 22:41:20+00:00,I will be lowering the flags on all Federal Buildings and National Monuments to half-staff over the next three days in memory of the Americans we have lost to the CoronaVirus....,https://twitter.com/realDonaldTrump
2020-05-21 01:36:30+00:00,"Spokesman speaks stupidly on behalf of China, trying desperately to deflect the pain and carnage that their country spread throughout the world. Its disinformation and propaganda attack on the United States and Europe is a disgrace....",https://twitter.com/realDonaldTrump
2020-05-19 02:55:27+00:00,This is the letter sent to Dr. Tedros of the World Health Organization. It is self-explanatory! https://t.co/pF2kzPUpDv,https://twitter.com/realDonaldTrump
2020-05-19 02:55:27+00:00,This is the letter sent to Dr. Tedros of the World Health Organization. It is self-explanatory! https://t.co/pF2kzPUpDv,https://twitter.com/realDonaldTrump
2020-05-18 15:01:51+00:00,OIL (ENERGY) IS BACK!!!!,https://twitter.com/realDonaldTrump
2020-05-14 12:37:51+00:00,"I don’t know the so-called Whistleblower Rick Bright, never met him or even heard of him, but to me he is a disgruntled employee, not liked or respected by people I spoke to and who, with his attitude, should no longer be working for our government!",https://twitter.com/realDonaldTrump
2020-05-16 13:30:37+00:00,"We’ve done a GREAT job on Covid response, making all Governors look good, some fantastic (and that’s OK), but the Lamestream Media doesn’t want to go with that narrative, and the Do Nothing Dems talking point is to say only bad about “Trump”. I made everybody look good, but me!",https://twitter.com/realDonaldTrump
2020-05-11 13:56:57+00:00,"Coronavirus numbers are looking MUCH better, going down almost everywhere. Big progress being made!",https://twitter.com/realDonaldTrump
2020-05-10 23:25:53+00:00,".@CBS and their show, @60Minutes, are doing everything within their power, which is far less today than it was in the past, to defend China and the horrible Virus pandemic that was inflicted on the USA and the rest of the World. I guess they want to do business in China!",https://twitter.com/realDonaldTrump
2020-05-10 11:48:52+00:00,"We are getting great marks for the handling of the CoronaVirus pandemic, especially the very early BAN of people from China, the infectious source, entering the USA. Compare that to the Obama/Sleepy Joe disaster known as H1N1 Swine Flu. Poor marks, bad polls - didn’t have a clue!",https://twitter.com/realDonaldTrump
2020-05-10 11:48:52+00:00,"We are getting great marks for the handling of the CoronaVirus pandemic, especially the very early BAN of people from China, the infectious source, entering the USA. Compare that to the Obama/Sleepy Joe disaster known as H1N1 Swine Flu. Poor marks, bad polls - didn’t have a clue!",https://twitter.com/realDonaldTrump
2020-05-10 11:48:52+00:00,"We are getting great marks for the handling of the CoronaVirus pandemic, especially the very early BAN of people from China, the infectious source, entering the USA. Compare that to the Obama/Sleepy Joe disaster known as H1N1 Swine Flu. Poor marks, bad polls - didn’t have a clue!",https://twitter.com/realDonaldTrump
2020-05-08 11:29:39+00:00,DRAIN THE SWAMP!,https://twitter.com/realDonaldTrump
2020-05-08 11:29:39+00:00,DRAIN THE SWAMP!,https://twitter.com/realDonaldTrump
2020-05-06 13:06:09+00:00,"....gloves, gowns etc. are now plentiful. The last four Governors teleconference calls have been conclusively strong. Because of this success, the Task Force will continue on indefinitely with its focus on SAFETY &amp; OPENING UP OUR COUNTRY AGAIN. We may add or subtract people ....",https://twitter.com/realDonaldTrump
2020-05-06 13:05:58+00:00,"The White House CoronaVirus Task Force, headed by Vice President Mike Pence, has done a fantastic job of bringing together vast highly complex resources that have set a high standard for others to follow in the future. Ventilators, which were few &amp; in bad shape, are now being....",https://twitter.com/realDonaldTrump
2020-05-05 16:55:29+00:00,"The Do Nothing Democrats and their leader, the Fake News Lamestream Media, are doing everything possible to hurt and disparage our Country. No matter what we do or say, no matter how big a win, they report that it was a loss, or not good enough. The Enemy of the People!",https://twitter.com/realDonaldTrump
2020-05-05 16:55:29+00:00,"The Do Nothing Democrats and their leader, the Fake News Lamestream Media, are doing everything possible to hurt and disparage our Country. No matter what we do or say, no matter how big a win, they report that it was a loss, or not good enough. The Enemy of the People!",https://twitter.com/realDonaldTrump
2020-05-03 20:18:19+00:00,"Intelligence has just reported to me that I was correct, and that they did NOT bring up the CoronaVirus subject matter until late into January, just prior to my banning China from the U.S. Also, they only spoke of the Virus in a very non-threatening, or matter of fact, manner...",https://twitter.com/realDonaldTrump
2020-05-03 18:10:00+00:00,Thank you very much to our beautiful “boaters.” I will never let you down! https://t.co/Ot5Ffnjj9G,https://twitter.com/realDonaldTrump
2020-04-26 18:28:35+00:00,"I work from early in the morning until late at night, haven’t left the White House in many months (except to launch Hospital Ship Comfort) in order to take care of Trade Deals, Military Rebuilding etc., and then I read a phony story in the failing @nytimes about my work....",https://twitter.com/realDonaldTrump
2020-02-26 13:03:21+00:00,"Low Ratings Fake News MSDNC (Comcast) &amp; @CNN are doing everything possible to make the Caronavirus look as bad as possible, including panicking markets, if possible. Likewise their incompetent Do Nothing Democrat comrades are all talk, no action. USA in great shape! @CDCgov.....",https://twitter.com/realDonaldTrump
2020-04-25 22:17:13+00:00,"Remember, the Cure can’t be worse than the problem itself. Be careful, be safe, use common sense!",https://twitter.com/realDonaldTrump
2020-04-25 15:06:08+00:00,"The Do Nothing Democrats are spending much of their money on Fake Ads. I never said that the CoronaVirus is a “Hoax”, I said that the Democrats, and the way they lied about it, are a Hoax. Also, it did start with “one person from China”, and then grew, &amp; will be a “Miracle” end!",https://twitter.com/realDonaldTrump
2020-04-25 15:06:08+00:00,"The Do Nothing Democrats are spending much of their money on Fake Ads. I never said that the CoronaVirus is a “Hoax”, I said that the Democrats, and the way they lied about it, are a Hoax. Also, it did start with “one person from China”, and then grew, &amp; will be a “Miracle” end!",https://twitter.com/realDonaldTrump
2020-04-24 13:53:25+00:00,Our Country wants to move safely forward. There is a tremendous pent up demand. We will open big!,https://twitter.com/realDonaldTrump
2020-04-21 02:06:22+00:00,"In light of the attack from the Invisible Enemy, as well as the need to protect the jobs of our GREAT American Citizens, I will be signing an Executive Order to temporarily suspend immigration into the United States!",https://twitter.com/realDonaldTrump
2020-04-19 19:18:05+00:00,"“On February 19th there was a Democratic Debate, in Las Vegas. Three words weren’t said: Virus, CoronaVirus, or COVID19. NEVER came up!” @BretBaier",https://twitter.com/realDonaldTrump
2020-04-17 16:25:30+00:00,"Biden/Obama were a disaster in handling the H1N1 Swine Flu. Polling at the time showed disastrous approval numbers. 17,000 people died unnecessarily and through incompetence! Also, don’t forget their 5 Billion Dollar Obamacare website that should have cost close to nothing!",https://twitter.com/realDonaldTrump
2020-04-17 13:20:29+00:00,Why did the W.H.O. Ignore an email from Taiwanese health officials in late December alerting them to the possibility that CoronaVirus could be transmitted between humans? Why did the W.H.O. make several claims about the CoronaVirus that ere either inaccurate or misleading....,https://twitter.com/realDonaldTrump
2020-04-14 23:25:07+00:00,https://t.co/KRxBA0OjpX,https://twitter.com/realDonaldTrump
2020-04-12 19:49:37+00:00,"Just watched Mike Wallace wannabe, Chris Wallace, on @FoxNews. I am now convinced that he is even worse than Sleepy Eyes Chuck Todd of Meet the Press(please!), or the people over at Deface the Nation. What the hell is happening to @FoxNews. It’s a whole new ballgame over there!",https://twitter.com/realDonaldTrump
2020-04-12 22:51:33+00:00,"Sorry Fake News, it’s all on tape. I banned China long before people spoke up. Thank you @OANN",https://twitter.com/realDonaldTrump
2020-04-12 20:43:12+00:00,"If the Fake News Opposition Party is pushing, with all their might, the fact that President Trump “ignored early warnings about the threat,” then why did Media &amp; Dems viciously criticize me when I instituted a Travel Ban on China? They said “early &amp; not necessary.” Corrupt Media!",https://twitter.com/realDonaldTrump
2020-04-12 16:14:52+00:00,"Great businessman &amp; philanthropist Bernie Marcus, Co-Founder of Home Depot, said that Congress was too distracted by the (phony) Impeachment Witch Hunt when they should have been investigating  CoronaVirus when it first appeared in China. Media played a big roll also!@dcexaminer",https://twitter.com/realDonaldTrump
2020-04-12 16:14:52+00:00,"Great businessman &amp; philanthropist Bernie Marcus, Co-Founder of Home Depot, said that Congress was too distracted by the (phony) Impeachment Witch Hunt when they should have been investigating  CoronaVirus when it first appeared in China. Media played a big roll also!@dcexaminer",https://twitter.com/realDonaldTrump
2020-04-10 15:42:10+00:00,"Nobody wants to say that if Elizabeth Warren gets out of the race before Super Tuesday, Crazy Bernie Sanders wins virtually every state in a blowout...NOT EVEN CLOSE!  I haven’t heard one member of the Fake News Establishment even mention this irrefutable fact. FAKE NEWS!",https://twitter.com/realDonaldTrump
2020-04-06 15:34:27+00:00,"Joe Biden wanted the date for the Democrat National Convention moved to a later time period. Now he wants a “Virtual” Convention, one where he doesn’t have to show up. Gee, I wonder why? Also, what ever happened to that phone call he told the Fake News he wanted to make to me?",https://twitter.com/realDonaldTrump
2020-04-06 15:34:27+00:00,"Joe Biden wanted the date for the Democrat National Convention moved to a later time period. Now he wants a “Virtual” Convention, one where he doesn’t have to show up. Gee, I wonder why? Also, what ever happened to that phone call he told the Fake News he wanted to make to me?",https://twitter.com/realDonaldTrump
2020-04-06 11:55:14+00:00,LIGHT AT THE END OF THE TUNNEL!,https://twitter.com/realDonaldTrump
2020-04-03 17:12:57+00:00,"Highly respected Justice Daniel Kelly is running for the Supreme Court in the Great State of Wisconsin. Justice Kelly has been doing a terrific job upholding the Rule of Law and defending your #2A. Tough on Crime, Loves our Military and our Vets. He has my Complete Endorsement!",https://twitter.com/realDonaldTrump
2020-03-09 14:47:59+00:00,"So last year 37,000 Americans died from the common Flu. It averages between 27,000 and 70,000 per year. Nothing is shut down, life &amp; the economy go on. At this moment there are 546 confirmed cases of CoronaVirus, with 22 deaths. Think about that!",https://twitter.com/realDonaldTrump
2020-03-31 14:48:43+00:00,"With interest rates for the United States being at ZERO, this is the time to do our decades long awaited Infrastructure Bill. It should be VERY BIG &amp; BOLD, Two Trillion Dollars, and be focused solely on jobs and rebuilding the once great infrastructure of our Country! Phase 4",https://twitter.com/realDonaldTrump
2020-03-29 17:48:36+00:00,"“President Trump is a ratings hit. Since reviving the daily White House briefing Mr. Trump and his coronavirus updates have attracted an average audience of 8.5 million on cable news, roughly the viewership of the season finale of ‘The Bachelor.’ Numbers are continuing to rise...",https://twitter.com/realDonaldTrump
2020-03-29 14:01:57+00:00,Will be doing a press conference today at 5:00 P.M. The White House. People are working harder than I have ever seen people work. It is a beautiful thing to watch!,https://twitter.com/realDonaldTrump
2020-03-28 02:29:57+00:00,"I love Michigan, one of the reasons we are doing such a GREAT job for them during this horrible Pandemic. Yet your Governor, Gretchen “Half” Whitmer is way in over her head, she doesn’t have a clue. Likes blaming everyone for her own ineptitude! #MAGA",https://twitter.com/realDonaldTrump
2020-03-27 05:19:02+00:00,Just finished a very good conversation with President Xi of China. Discussed in great detail the CoronaVirus that is ravaging large parts of our Planet. China has been through much &amp; has developed a strong understanding of the Virus. We are working closely together. Much respect!,https://twitter.com/realDonaldTrump
2020-03-27 05:19:02+00:00,Just finished a very good conversation with President Xi of China. Discussed in great detail the CoronaVirus that is ravaging large parts of our Planet. China has been through much &amp; has developed a strong understanding of the Virus. We are working closely together. Much respect!,https://twitter.com/realDonaldTrump
2020-03-26 20:57:15+00:00,Will be going out in 10 minutes for the press conference.,https://twitter.com/realDonaldTrump
2020-03-26 04:48:58+00:00,96-0 in the United States Senate. Congratulations AMERICA!,https://twitter.com/realDonaldTrump
2020-03-24 14:16:34+00:00,"Our people want to return to work. They will practice Social Distancing and all else, and Seniors will be watched over protectively &amp; lovingly. We can do two things together. THE CURE CANNOT BE WORSE (by far) THAN THE PROBLEM! Congress MUST ACT NOW. We will come back strong!",https://twitter.com/realDonaldTrump
2020-03-24 14:16:34+00:00,"Our people want to return to work. They will practice Social Distancing and all else, and Seniors will be watched over protectively &amp; lovingly. We can do two things together. THE CURE CANNOT BE WORSE (by far) THAN THE PROBLEM! Congress MUST ACT NOW. We will come back strong!",https://twitter.com/realDonaldTrump
2020-03-24 12:45:18+00:00,"Congress must approve the deal, without all of the nonsense, today. The longer it takes, the harder it will be to start up our economy. Our workers will be hurt!",https://twitter.com/realDonaldTrump
2020-03-23 14:16:00+00:00,THIS IS WHY WE NEED BORDERS!,https://twitter.com/realDonaldTrump
2020-03-21 14:13:08+00:00,"HYDROXYCHLOROQUINE &amp; AZITHROMYCIN, taken together, have a real chance to be one of the biggest game changers in the history of medicine. The FDA has moved mountains - Thank You! Hopefully they will BOTH (H works better with A, International Journal of Antimicrobial Agents).....",https://twitter.com/realDonaldTrump
2020-03-18 13:29:58+00:00,"95% Approval Rating in the Republican Party, 53% overall. Not bad considering I get nothing but Fake &amp; Corrupt News, day and night. “Russia, Russia, Russia”, then “the Ukraine Scam (where’s the Whistleblower?)”, the “Impeachment Hoax”, and more, more, more....",https://twitter.com/realDonaldTrump
2020-03-18 11:46:33+00:00,"I always treated the Chinese Virus very seriously, and have done a very good job from the beginning, including my very early decision to close the “borders” from China - against the wishes of almost all. Many lives were saved. The Fake News new narrative is disgraceful &amp; false!",https://twitter.com/realDonaldTrump
2020-03-18 11:12:49+00:00,I will be having a news conference today to discuss very important news from the FDA concerning the Chinese Virus!,https://twitter.com/realDonaldTrump
2020-03-18 13:37:46+00:00,"We will be, by mutual consent, temporarily closing our Northern Border with Canada to non-essential traffic. Trade will not be affected. Details to follow!",https://twitter.com/realDonaldTrump
2020-03-18 11:12:49+00:00,I will be having a news conference today to discuss very important news from the FDA concerning the Chinese Virus!,https://twitter.com/realDonaldTrump
2020-03-18 11:46:33+00:00,"I always treated the Chinese Virus very seriously, and have done a very good job from the beginning, including my very early decision to close the “borders” from China - against the wishes of almost all. Many lives were saved. The Fake News new narrative is disgraceful &amp; false!",https://twitter.com/realDonaldTrump
2020-03-18 10:41:14+00:00,"For the people that are now out of work because of the important and necessary containment policies, for instance the shutting down of hotels, bars and restaurants, money will soon be coming to you. The onslaught of the Chinese Virus is not your fault! Will be stronger than ever!",https://twitter.com/realDonaldTrump
2020-03-17 19:31:33+00:00,The world is at war with a hidden enemy. WE WILL WIN!,https://twitter.com/realDonaldTrump
2020-03-17 12:22:11+00:00,"Cuomo wants “all states to be treated the same.” But all states aren’t the same. Some are being hit hard by the Chinese Virus, some are being hit practically not at all. New York is a very big “hotspot”, West Virginia has, thus far, zero cases. Andrew, keep politics out of it....",https://twitter.com/realDonaldTrump
2020-03-16 22:51:54+00:00,"The United States will be powerfully supporting those industries, like Airlines and others, that are particularly affected by the Chinese Virus. We will be stronger than ever before!",https://twitter.com/realDonaldTrump
2020-03-16 22:51:54+00:00,"The United States will be powerfully supporting those industries, like Airlines and others, that are particularly affected by the Chinese Virus. We will be stronger than ever before!",https://twitter.com/realDonaldTrump
2020-03-16 22:51:54+00:00,"The United States will be powerfully supporting those industries, like Airlines and others, that are particularly affected by the Chinese Virus. We will be stronger than ever before!",https://twitter.com/realDonaldTrump
2020-03-15 17:29:03+00:00,"So now it is reported that, after destroying his life &amp; the life of his wonderful family (and many others also), the FBI, working in conjunction with the Justice Department, has “lost” the records of General Michael Flynn. How convenient. I am strongly considering a Full Pardon!",https://twitter.com/realDonaldTrump
2020-03-15 17:02:00+00:00,"There will be a News Conference by the CoronaVirus Task Force today at the White House, 5 P.M. @VP  We are working closely with the Governors of our Country’s great States, which are a very big factor. They are working hard, along with us, to get the job properly done.....",https://twitter.com/realDonaldTrump
2020-03-15 16:34:23+00:00,"We are doing very precise Medical Screenings at our airports. Pardon the interruptions and delays, we are moving as quickly as possible, but it is very important that we be vigilant and careful. We must get it right. Safety first!",https://twitter.com/realDonaldTrump
2020-03-15 17:02:00+00:00,"....The USA was never set up for this, just look at the catastrophe of the H1N1 Swine Flu (Biden in charge, 17,000 people lost, very late response time), but it soon will be. Great decision to close our China, and other, borders early. Saved many lives!",https://twitter.com/realDonaldTrump
2020-03-15 01:49:27+00:00,https://t.co/XVPCplTDQn,https://twitter.com/realDonaldTrump
2020-03-14 15:57:29+00:00,News Conference at White House in 10 minutes.,https://twitter.com/realDonaldTrump
2020-03-14 00:42:25+00:00,"I fully support H.R. 6201: Families First CoronaVirus Response Act, which will be voted on in the House this evening. This Bill will follow my direction for free CoronaVirus tests, and paid sick leave for our impacted American workers. I have directed....",https://twitter.com/realDonaldTrump
2020-03-14 00:42:25+00:00,"I fully support H.R. 6201: Families First CoronaVirus Response Act, which will be voted on in the House this evening. This Bill will follow my direction for free CoronaVirus tests, and paid sick leave for our impacted American workers. I have directed....",https://twitter.com/realDonaldTrump
2013-11-08 19:01:16+00:00,"Leadership: Whatever happens, you're responsible. If it doesn't happen, you're responsible.",https://twitter.com/realDonaldTrump
