date,renderedContent,user
2020-03-13 10:22:17+00:00,"For decades the @CDCgov looked at, and studied,  its testing system, but did nothing about it. It would always be inadequate and slow for a large scale pandemic, but a pandemic would never happen, they hoped. President Obama made changes that only complicated things further.....",https://twitter.com/realDonaldTrump
2020-03-13 10:22:17+00:00,"For decades the @CDCgov looked at, and studied,  its testing system, but did nothing about it. It would always be inadequate and slow for a large scale pandemic, but a pandemic would never happen, they hoped. President Obama made changes that only complicated things further.....",https://twitter.com/realDonaldTrump
2020-03-12 18:01:55+00:00,"KEEPING THE HOME SAFE, ENCOURAGE YOUR FAMILY MEMBERS TO.... https://t.co/2hUQuUvGQb",https://twitter.com/realDonaldTrump
2020-03-13 02:20:56+00:00,"Sleepy Joe Biden was in charge of the H1N1 Swine Flu epidemic which killed thousands of people. The response was one of the worst on record. Our response is one of the best, with fast action of border closings &amp; a 78% Approval Rating, the highest on record. His was lowest!",https://twitter.com/realDonaldTrump
2020-03-12 02:11:12+00:00,https://t.co/YioC9eARdP,https://twitter.com/realDonaldTrump
2020-03-12 02:13:32+00:00,"Hoping to get the payroll tax cut approved by both Republicans and Democrats, and please remember, very important for all countries &amp; businesses to know that trade will in no way be affected by the 30-day restriction on travel from Europe. The restriction stops people not goods.",https://twitter.com/realDonaldTrump
2020-03-11 20:44:36+00:00,I will be addressing the Nation this evening at 9:00 P.M. (Eastern) from the Oval Office.,https://twitter.com/realDonaldTrump
2020-03-11 22:04:26+00:00,"The Media should view this as a time of unity and strength. We have a common enemy, actually, an enemy of the World, the CoronaVirus. We must beat it as quickly and safely as possible. There is nothing more important to me than the life &amp; safety of the United States!",https://twitter.com/realDonaldTrump
2020-03-11 20:44:36+00:00,I will be addressing the Nation this evening at 9:00 P.M. (Eastern) from the Oval Office.,https://twitter.com/realDonaldTrump
2020-03-11 19:18:35+00:00,I am fully prepared to use the full power of the Federal Government to deal with our current challenge of the CoronaVirus!,https://twitter.com/realDonaldTrump
2020-03-09 14:47:59+00:00,"So last year 37,000 Americans died from the common Flu. It averages between 27,000 and 70,000 per year. Nothing is shut down, life &amp; the economy go on. At this moment there are 546 confirmed cases of CoronaVirus, with 22 deaths. Think about that!",https://twitter.com/realDonaldTrump
2020-03-09 13:16:05+00:00,The BEST decision made was the toughest of them all - which saved many lives. Our VERY early decision to stop travel to and from certain parts of the world!,https://twitter.com/realDonaldTrump
2020-03-08 22:18:35+00:00,"Who knows what this means, but it sounds good to me!",https://twitter.com/realDonaldTrump
2020-03-09 14:36:49+00:00,"Good for the consumer, gasoline prices coming down!",https://twitter.com/realDonaldTrump
2020-03-09 13:16:05+00:00,The BEST decision made was the toughest of them all - which saved many lives. Our VERY early decision to stop travel to and from certain parts of the world!,https://twitter.com/realDonaldTrump
2020-03-09 11:20:43+00:00,"The Fake News Media and their partner, the Democrat Party, is doing everything within its semi-considerable power (it used to be greater!) to inflame the CoronaVirus situation, far beyond what the facts would warrant. Surgeon General, “The risk is low to the average American.”",https://twitter.com/realDonaldTrump
2020-03-08 12:45:45+00:00,"We have a perfectly coordinated and fine tuned plan at the White House for our attack on CoronaVirus. We moved VERY early to close borders to certain areas, which was a Godsend. V.P. is doing a great job. The Fake News Media is doing everything possible to make us look bad. Sad!",https://twitter.com/realDonaldTrump
2014-03-28 12:35:50+00:00,"Healthy young child goes to doctor, gets pumped with massive shot of many vaccines, doesn't feel good and changes - AUTISM. Many such cases!",https://twitter.com/realDonaldTrump
2020-03-03 23:18:04+00:00,"The National Institutes of Health is home to some of the greatest doctors, scientists, and researchers in the world. Thank you for all your doing @NIH, keep up the great work! https://t.co/oLi8HbSzlY",https://twitter.com/realDonaldTrump
2014-10-15 14:32:04+00:00,President Obama has a personal responsibility to visit &amp; embrace all people in the US who contract Ebola!,https://twitter.com/realDonaldTrump
2014-10-15 14:32:04+00:00,President Obama has a personal responsibility to visit &amp; embrace all people in the US who contract Ebola!,https://twitter.com/realDonaldTrump
2014-10-15 14:32:04+00:00,President Obama has a personal responsibility to visit &amp; embrace all people in the US who contract Ebola!,https://twitter.com/realDonaldTrump
2020-02-29 17:02:35+00:00,I will be having a 1:30 P.M. Press Conference at the White House to discuss the latest CoronaVirus developments. Thank you!,https://twitter.com/realDonaldTrump
2020-02-28 05:05:02+00:00,"So, the Coronavirus, which started in China and spread to various countries throughout the world, but very slowly in the U.S. because President Trump closed our border, and ended flights, VERY EARLY, is now being blamed, by the Do Nothing Democrats, to be the fault of “Trump”.",https://twitter.com/realDonaldTrump
2020-02-28 01:53:59+00:00,“Anti-Trump Network @CNN doing whatever it can to stoke a national Coronavirus panic. The far left Network pretty much ignoring anyone who they interview who doesn’t blame President Trump.” @trish_regan @FoxNews Media refuses to discuss the great job our professionals are doing!,https://twitter.com/realDonaldTrump
2020-02-25 14:02:15+00:00,"Cryin’ Chuck Schumer is complaining, for publicity purposes only, that I should be asking for more money than $2.5 Billion to prepare for Coronavirus. If I asked for more he would say it is too much. He didn’t like my early travel closings. I was right. He is incompetent!",https://twitter.com/realDonaldTrump
2020-02-24 21:42:02+00:00,The Coronavirus is very much under control in the USA. We are in contact with everyone and all relevant countries. CDC &amp; World Health have been working hard and very smart. Stock Market starting to look very good to me!,https://twitter.com/realDonaldTrump
2020-02-26 13:03:21+00:00,"Low Ratings Fake News MSDNC (Comcast) &amp; @CNN are doing everything possible to make the Caronavirus look as bad as possible, including panicking markets, if possible. Likewise their incompetent Do Nothing Democrat comrades are all talk, no action. USA in great shape! @CDCgov.....",https://twitter.com/realDonaldTrump
2020-02-26 13:03:27+00:00,"I will be having a News Conference at the White House, on this subject, today at 6:00 P.M. CDC representatives, and others, will be there. Thank you!",https://twitter.com/realDonaldTrump
2020-02-26 13:03:27+00:00,"I will be having a News Conference at the White House, on this subject, today at 6:00 P.M. CDC representatives, and others, will be there. Thank you!",https://twitter.com/realDonaldTrump
