date,renderedContent,user
2021-12-08 08:16:03+00:00,"Is Indian boy who predict the covid thing debunked already.

Why people so selective of his prediction.

Why he cannot predict Man U score?

Why he cannot predict if Delta incubation period

And whether mRNA or non MRNA is better
Why he cannot predict Pritam Singh will cock up",https://twitter.com/temptempholder
2021-12-07 08:21:13+00:00,"According to forum logic.

Not announcing daily covid report 

Is 

Govt is hiding data to cover up vaccinated deaths!! No test no count!

I would like to see forum people being punished fully as they have been doing these for past 2 years whenever there is format change!",https://twitter.com/temptempholder
2021-12-06 15:57:58+00:00,"Just does not mean there never has been a serious pandemic means covid19 type will not happen 

Just because covid kill only 0.2% or so of population does not mean

That a 5% killed will not be next on card. 350 million deaths.",https://twitter.com/temptempholder
2021-12-06 05:10:05+00:00,"Hmm.. reflecting on this as I live through
1)covid
2)Pritam
3)Personal problems",https://twitter.com/temptempholder
2021-12-03 11:44:54+00:00,"Apologist until like that. And got 1000 people like. 
If I were lky, I would surely get up from my grave.

She did not just make a mistake. 
She smeared the good name of police IREVERSIBLY and made PAP run around the circus like a fool wasting precious time in covid for 4 months! https://t.co/zwgxigxoS3",https://twitter.com/temptempholder
2021-12-03 01:17:11+00:00,"Meaning? I guess I will have to vaccinate soon with booster then after my recent infection. So mine will be M-M-D-P or M-M-D-M 

Which path to hell will I choose? 
D- delta covid infected

@sporeMOH please advise we such group when we will send me my booster message @GovTechSG",https://twitter.com/temptempholder
2021-11-30 15:48:16+00:00,"Scapegoat of the century : Raeesah Khan

Directed by: Most Opaque Political Party in world , Worker Party where she lied 3 times and end up is  pressured by PAP investigation when PAP resources could be better use for covid crisis. 

Give them thunderous applause pls https://t.co/1CXsY72Xsn",https://twitter.com/temptempholder
2021-11-30 12:43:53+00:00,"As a math person.
I think I have ability to pull off the student and rally all Students of Math in primary and secondary to unite and present a coherent Mathematical view of covid along side govt explanation of covid

We should be able to put together a covid newsletter",https://twitter.com/temptempholder
2021-11-30 12:24:35+00:00,Covid 19 2years = Sept 11 terrorist attack happening 1750 times,https://twitter.com/temptempholder
2021-11-30 08:53:36+00:00,"Me: We not grateful for China for their procrastination level on covid, like How Pritam also dun bother to check Raeesah for lying three times in parliament

Ong Ye Kung: S'pore medical community 'very grateful' to South Africa for Omicron variant warning mothership.sg/2021/11/singap…",https://twitter.com/temptempholder
2021-11-30 05:45:59+00:00,"My co worker who is my father era,  family got covid one by one. He is worried, especially with his elderly mother",https://twitter.com/temptempholder
2021-11-30 03:00:44+00:00,"First hand hear a case where vaccinated young adult die shortly after vaccination

The people involved prefer to think in terms of causation

But correlation is not causation
But did not argue w them

I am Vax, hence protected from covid as I got covid recently and is fine",https://twitter.com/temptempholder
2021-11-29 01:27:32+00:00,"Never forget that some Singaporean crying father crying mother about letting Delta come in from India and blaming Singapore govt.

What a joke they r

As if it can ever be prevented from coming into Singapore by just border closure quick

As if managing covid is like flip switch",https://twitter.com/temptempholder
2021-11-26 17:26:42+00:00,"About 1001 ways you and your family can die beside covid19
Alot of people must have been killed due to ignorance because they focus way too much time on covid and forget to take care of other causes of death

All in all, my Moody's outlook my life
:SELL 

-Notea of top tier coach",https://twitter.com/temptempholder
2021-11-26 17:26:42+00:00,"Has dropped to about 3 per day which is good but I do not know why?
Still damn dangerous still to my family in my opinion
Merck covid pill latest update has decreased in efficacy and safety
There are other causes in death as well which people seemed to forget
Do not forget",https://twitter.com/temptempholder
2021-11-26 17:26:41+00:00,"Singapore has roughly 5.5 million people. 
A quarter of million people have covid.
Numbers drop now to 1000/day
Fraction of population with covid is thus 1/22 
That's incidence rate of about 4.5%
Most people do not have delta variant covid yet
Herd immunity, vaccinated, booster",https://twitter.com/temptempholder
2021-11-25 14:28:55+00:00,"With covid mutation still ongoing, I can see how genocide 2.0 will occur  as humans tarts going apeshit crazy with the neverending story",https://twitter.com/temptempholder
2021-11-25 02:08:00+00:00,"mRNA Vax (I am thankful for that) plus being boosted (maybe be unfortunate in the end I cannot tell for sure) by actual covid virus breakthrough infection.

I believe there are still many facts , tons of them, waiting to be uncovered which we NEED to faster learn.

It my",https://twitter.com/temptempholder
2021-11-25 02:08:00+00:00,"The science of covid and vaccine are incomplete .

We should still continue to learn more about them because we are literally just at first two years of the new disease.

There is much more details that we need to unearth because otherwise we are still flying blind.

I m double",https://twitter.com/temptempholder
2021-11-25 01:47:29+00:00,"Just nice Ed Yong made this thread, about long covid.",https://twitter.com/temptempholder
2021-11-25 01:39:02+00:00,"Can we also collect the stats for oral covid pills from Merck, Pfizer

We need more tables showing all the variables and their outcomes

Hope USA will crunch out these numbers as these covid pills are on verge on releasing in mass amount",https://twitter.com/temptempholder
2021-11-25 01:33:58+00:00,"25 Nov 2021, Singapore forum still got many people showing 'evidence' that says they are right to avoid mRNA cos of some experiment done.
They die die want to bite on the mRNA train and frame covid is just a mild flu

Mild flu is after being vaxxed mRNA leh. https://t.co/GmBSK5ABbC",https://twitter.com/temptempholder
2021-11-25 01:17:37+00:00,"VTL is finally opened for Mars and Earth 
I shall have the honour of bringing the first covid case to share with Marsiling.
When I reached Mar, I will take Marsiling MRT train to their CBD area
Mode of transport: Blue Origin",https://twitter.com/temptempholder
2021-11-24 17:43:59+00:00,"Covid meeting among themselves: we have verified it experimentally, and our hypothesis is true. we conclude that humans can't get their shit together",https://twitter.com/temptempholder
2021-11-24 16:17:28+00:00,"Getting a mild infection after Covid-19 vaccination gives best protection against future variants: Expert

Current vaccines teach the body to recognise the spike proteins on the surface of the virus, but that could change as the virus mutates.

.

straitstimes.com/singapore/heal…",https://twitter.com/temptempholder
2021-11-24 15:37:52+00:00,"This two days like no diahorrea.
Finger cross.
Fuck Sia.
Covid or due to mala dishes or due to Eternals fighting Demons in me.

Correlation is not causation you bitch",https://twitter.com/temptempholder
2021-11-24 11:27:16+00:00,"Seeing people taking turns to discriminate and be discriminated others based on perception of people who have covid 

Is sure a fun way https://t.co/9B1Qyqh2Up",https://twitter.com/temptempholder
2021-11-24 09:38:16+00:00,Client heard I covid positive like spooked like that. Delay meeting me until long enough,https://twitter.com/temptempholder
2021-11-21 07:09:26+00:00,"Can u imagine how powerful covid is.

There are people in world right now telling parents if they do X, they will die,

And their parents insist that if the do X , they will actually live

And both sides are torn apart and unconvinced

But either way, covid is going kill one side",https://twitter.com/temptempholder
2021-11-20 02:01:36+00:00,"Other than weird minor symptom , as a positive person, I dunno what to say of covid.

It makes me think about being diagnosed with other types of illness too.

What does it mean to be having X?",https://twitter.com/temptempholder
2021-11-18 16:50:01+00:00,Covid 19 seemed to be like Marvel End game where it is out numbered by evil vaccines and pills appearing but then all its allies in the world start teleporting last minute to save the earth from humanity,https://twitter.com/temptempholder
2021-11-18 08:30:13+00:00,"15th day of symptom
9th day of hotel stay
2nd grab food order with free porridge after order came with spillage and my creative writing complaints to Grab on my son story life.
Negative ART second time after I see bunk mate tested positive still. He got covid later than I did. https://t.co/C7psjnlrv3",https://twitter.com/temptempholder
2021-11-18 08:21:25+00:00,"6th day Of minor symptom, wed, finally relented and decide to take official govt route of being identified as covid positive officially and take 10 day isolation order. https://t.co/zi0x2UJTiy",https://twitter.com/temptempholder
2021-11-18 04:27:25+00:00,"Yo. I just experienced these drivers.
Tbh. They were driving too dangerous enroute to hotel and I was nearly killed by both their driving and covid.",https://twitter.com/temptempholder
2021-11-18 00:56:36+00:00,"As a double Vax Moderna ex covid patient, I wonder if am damaged too permanently. I am definitely still functional now, I was not exactly healthy either before getting covid.

Maybe I become healthier after covid because of my increased awareness of death due to some cork up also",https://twitter.com/temptempholder
2021-11-17 07:21:48+00:00,"Literally when I have cough during my covid positive infection, my father was so damn afraid my lungs will be ravaged by covid soon that he dished out this same exact nonsense fearing for my life if I did not take it. 
I quarrel and gave in to his smelling garlic , herbal drink. https://t.co/Qml57oddwi",https://twitter.com/temptempholder
2021-11-14 07:55:49+00:00,Maybe I got long covid.,https://twitter.com/temptempholder
2021-11-14 01:41:32+00:00,"Thing of what I want to do when I am trying to recover from covid positive through my own way through my own research of proper newspaper media and radio channel interview and credited International doctors tweet, articles. But mostly local sources, MOH.",https://twitter.com/temptempholder
2021-11-13 10:36:06+00:00,"As someone who finish home and hotel recovery, I really cannot express how grateful I am to have covid in Singapore 1yr 10 months after it first occured.
As much as lives are loss, and my family is not safe yet, I still dun understand Singaporeans who complain non stop https://t.co/tn9N0stY5y",https://twitter.com/temptempholder
2021-11-13 08:42:34+00:00,"You know I am alpha ultra when I listened to @SamHarrisOrg
Old speech on unconditional happiness after exiting a 16th day isolation since covid positive.
That is why I am top tier life coach.
youtu.be/SpaVLLObU80",https://twitter.com/temptempholder
2021-11-13 02:33:53+00:00,"Tbh, Too many issues has happened to me for me to identify causality of health during isolation covid positive period.

I will not pretend to be smart enough to know what is what.

All I know is that I am urgent enough to vaccinated myself in Singapore 3.5mths before covid+",https://twitter.com/temptempholder
2021-11-12 21:04:15+00:00,7  hrs left after 10 days of isolation with covid. https://t.co/8LZHyrOxS3,https://twitter.com/temptempholder
2021-11-12 20:46:54+00:00,That I got covid in Singapore.,https://twitter.com/temptempholder
2021-11-12 20:46:53+00:00,"Beside usual fears of death of myself and my family and unknowns of my infection of covid with my vaccine and the long lasting minor symptom, 

I actually am super grateful as I see another set of knowledge from this 10 day course.

PAP is indeed a master in governance. Grateful",https://twitter.com/temptempholder
2021-11-12 14:59:41+00:00,"Covid is a proof that people dun believe any proof.
The only proof they will believe is when they see their coffin, when it is too late.
So many family are broken apart as a result of such idiocy of human brain.",https://twitter.com/temptempholder
2021-11-12 12:18:30+00:00,"Certified infected and battled finished first round with covid using Double Vax Method . 12 Nov 2021. 
The future is still unknown but still alive as of now. https://t.co/HuEtfFtNlF",https://twitter.com/temptempholder
2021-11-11 23:43:36+00:00,"12 Nov 2021. Some pics of food I had here. Personally, I am grateful for alot alot alot alot of things despite all hardship of my life. I am standing on shoulders of many good people who did their job so that I get to enjoy their skill. Tks to all covid related people. https://t.co/Duq3eRBW63",https://twitter.com/temptempholder
2021-10-28 17:01:08+00:00,"Done with the movie.
It's more of a philosophical homework for me.

I wonder how will my brain feel about what this movie is saying in the future.

Meanwhile , we could all die from covid. And other death causes.

So sadly, the movie NPC = US too

Given that we only have one life",https://twitter.com/temptempholder
2021-10-28 02:31:24+00:00,"So much govt effort.
If u dun contribute, at least dun criticise anyhow. 
People think to run country and fight covid , u just must sooner faster, more, predict accurate, buy more, lock fast, release rules quicker..
 Blah blah

They think play monopoly? Throw dice then can move https://t.co/5z8gNvcY47",https://twitter.com/temptempholder
2021-10-26 14:40:31+00:00,"I ask twitter instead employee got covid and did not come for 15 days .. can we as employer claim any benefits , money?

Anyone knowlegble?

Or ownself eat ownself.",https://twitter.com/temptempholder
2021-10-25 09:58:58+00:00,"Like nobody talks about Dee kosh.
Very soon nobody will talk about NOC issue.

Just move in with Ur life.
Ur life, Ur problem and Ur family is then the impt thing! And covid! https://t.co/K2dnYpJvIO",https://twitter.com/temptempholder
2021-10-25 07:23:51+00:00,"Human brain is serial processor. Dun give them complex news. Their brain only can handle gossip.
Covid measure task force national video by article on Saturday. 81k view.
Xiaxue interview about NOC one company issue yesterday 10pm. 623k views. https://t.co/hcfcYHm13m",https://twitter.com/temptempholder
2021-10-25 02:55:15+00:00,"@angeliIoqui @sapinautumn Moves on.. and it moves on it next saga

And I not interested to get my feet wet everytime small saga occur which does not affect 99% of singapore becos it not like a covid law or rule that is passed down

I cannot wait to stop thinking about NOC issue after I finish tweet. Bye!",https://twitter.com/temptempholder
2021-10-24 02:11:20+00:00,Opposition politician during this 2 years of covid and the things they have actually done. https://t.co/uvybgw8dft,https://twitter.com/temptempholder
2021-10-23 14:03:40+00:00,"Vaccine is still not cure all thing.
So basically my family still can die. 

Life can be short. 

It's tough tough world. 
It's all down to whether my family is unlucky enough.

Everyone will get covid for sure too someday",https://twitter.com/temptempholder
2021-10-23 07:21:11+00:00,Share Ur jokes to audience to people in Singapore or just intro yourself . Be co host. I outside so is noisy and not convienient to speak sometimes as covid. But I will lead the way and show u all the rope whenever I can.,https://twitter.com/temptempholder
2021-10-21 15:32:02+00:00,"Singaporean men are like filling up covid death number.

Covid is unequal.

Either that or Singaporean women have better healthy lifestyle than male counterpart.",https://twitter.com/temptempholder
2021-10-21 02:30:45+00:00,"3% of population is getting covid so far. Most people are not yet getting covid. 
It's a long and slow journey to queue up to get covid
Of course, another way is that covid somehow just die down after hitting certain percentage of population and the remaining people dun get covid",https://twitter.com/temptempholder
2021-10-19 07:44:30+00:00,"Covid 19 is the best death cafe ever organised since it was first formed to encourage people to tell about death and their own death.

So think positive. 
Every one can take part in it now that covid is in full swing.",https://twitter.com/temptempholder
2021-10-18 17:00:02+00:00,If community stabilises at 2000 per day. A 5 million population will take 2500 days to clear finish covid positive each person.,https://twitter.com/temptempholder
2021-10-17 10:17:12+00:00,"One big guy enter bus 161 . Complain abt rules, is drunk, dun pay , complains abt covid automated announcement.

Bus driver ask him to tap, he dun want . And ask captain to speak to him. The driver ignore him and let him in.

The big guy is still talking and whining.",https://twitter.com/temptempholder
2021-10-16 07:52:26+00:00,Covid task force can consult numerology https://t.co/qXCgEM3Lcx,https://twitter.com/temptempholder
2021-10-15 23:35:13+00:00,"Some people on twitter really act like overall commander saying govt and authority need to do
Task 1
Task 2
Task 3
Task 4
Task 5
Task 6 
Task 7

These will then solve the problems of covid issue.

Wow. These people are genius. 
The way they talk exudes 100% confidence in themself",https://twitter.com/temptempholder
2021-10-14 23:27:12+00:00,"Now I give u 28 days data. Three number.

78, 125, 62000 

78 ICU
125 died
62000 covid positive.",https://twitter.com/temptempholder
2021-10-14 23:24:19+00:00,"Some of u ask for community care facility..

Pls..

Home recovery is most practical..

Look at take up rate... Imagine all covid all go community facility.. how much mega project it will be.

Get covid. Just freaking go back home. Follow instruction. End of story! https://t.co/UNJ9CHbazd",https://twitter.com/temptempholder
2021-10-11 15:20:55+00:00,"How do u prevent Ur parent from commuting suicide by being unable to tell how science works and think that China is good guy and America is bad guy.

If they realize covid is real only when they are going to die.

How am I going to tell them? 

You see lah. I told you so.",https://twitter.com/temptempholder
2021-10-11 05:48:32+00:00,Pass law to make covid mandatory.. everywhere.... In the world,https://twitter.com/temptempholder
2021-10-11 00:12:19+00:00,In covid resilient world. My family has a chance of dying even though vaccinated.,https://twitter.com/temptempholder
2021-10-10 23:24:01+00:00,"Even China  Hongkong is living with covid.

They are merely holding out and pretending to say zero covid .... For now..

U think when they see world opening up travel lane...

They will still dream about their lockdown and close border and depend on ordering their local product?",https://twitter.com/temptempholder
2021-10-10 23:08:04+00:00,"Singapore no longer will nanny u.

Please own time own target recover, do test and then resume urself.

We are not focusing on case count so much!!

Covid graduation!",https://twitter.com/temptempholder
2021-10-10 15:40:23+00:00,"Meanwhile anti govt idiots is still pissing that govt should lockdown earlier and somehow we will then have little covid.

Ya... In the end.. vtl will still cause people to come in again..

Lockdown crazy people.. be cavemen better.

Another theory is scolding Vax!",https://twitter.com/temptempholder
2021-10-09 22:54:54+00:00,"@Crof We have  many facilities and differentiated to more types since delta.
Community treatment facility. (Stepped up service)
Community isolation facility. (For well covid cases who dun want to recover at home to spread to their at risk family member)
Community care facility .",https://twitter.com/temptempholder
2021-10-09 17:07:59+00:00,"Should we get covid as a family??

Hugging covid party in family once one detected??

Fuck.. no one to tell what is the best way to get covid. Or get later when medical team is more efficient.. in case things turn south.. https://t.co/yQx9EdRQCA",https://twitter.com/temptempholder
2021-10-09 16:59:29+00:00,"Singapore covid situation.
Most of us would be fine.

The minority 0.2%: https://t.co/eHtXJo0plL",https://twitter.com/temptempholder
2021-10-09 14:55:12+00:00,"3hr consecutive online tuition.
Rest , listen to 2 hr covid new normal plans.
6 HR consecutive face to face tuition.

I am dead.... Pls remember to ask my family to collect money if I sudden death to night.. 

Freaking far tuition..... 
But very good for saving amount this one!",https://twitter.com/temptempholder
2021-10-09 14:30:58+00:00,Everytime I talk to dumb people who cannot understand simple covid math https://t.co/EH15eBQBZq,https://twitter.com/temptempholder
2021-10-09 05:56:30+00:00,"Finished the 2hr MTF session and pm speech.
World is always danger, with or without covid. 
Just do as per new instruction .

And as always. Treasure your every seconds you have with people you care. Volunteer. And dun complain so much in life. Dun be like those armchair critic.",https://twitter.com/temptempholder
2021-10-09 00:12:47+00:00,Anti govt Singaporean are showing off when govt leaders are grinding and hustling to get things done amid covid handling!,https://twitter.com/temptempholder
2021-10-09 00:08:36+00:00,When u realize our Prime Minister is also a senior with history of two cancers. U fear for him to with covid affecting senior.,https://twitter.com/temptempholder
2021-10-08 15:39:58+00:00,"So fast KTV covid spread nobody talk Liao.
All goldfish memory.

When it happens.. everyone joins in and mill the issue.

So eh facepalm

It's all number game nowadays.

Where eyeball is.. is where everyone will be

Why u all so scared of having a meaningless life?",https://twitter.com/temptempholder
2021-10-08 11:20:58+00:00,"Relax.

Before covid. We are all going to die soon.

After covid . We are all going to die soon.

Die abit faster dun make much difference.",https://twitter.com/temptempholder
2021-10-08 10:55:23+00:00,"Tomorrow PM Lee covid speech is yet another milestone. Cos he dun speak often other than every few months ..

So if by tomorrow I still alive..

Will print a certificate of achievement.. for being alive as of

9 Oct 2021, Sat, 12 noon!

Not 100% there yet. Still can die tonight!",https://twitter.com/temptempholder
2021-10-08 10:22:21+00:00,"Please donate 
S'pore dad, 67, feels 'sorry' about passing Covid-19 to daughter with multiple medical conditions mothership.sg/2021/10/jalan-…",https://twitter.com/temptempholder
2021-10-07 23:32:54+00:00,"Those eligible to vaccinate but choose not to vaccinate without a valid reason. If they got covid and end up using the hospital resources.

Make no mistake about it.

We want to know who these people are. Eventually.

There is no free lunch.",https://twitter.com/temptempholder
2021-10-07 05:06:57+00:00,"Namely unlucky ones..

But all along governance and country management is a average sceince.

No country can ensure every family has equal outcomes after a policy is adopted.

It has always been like that and always will be.

Just that covid make this conflict even thornier.",https://twitter.com/temptempholder
2021-10-07 03:21:02+00:00,"Me waking up at 8am and being awake till 11.20am is unheard of for past 7 years. 

And then feeling sleepy 1am. 

It's epoche period.
It happened during covid . So can attribute to it.",https://twitter.com/temptempholder
2021-10-06 01:11:28+00:00,"Let's do some math.
Let's say 1 million old people.

1 day die 10 due to covid.

100 000 days for current batch of old people  that will die of covid.

300 years it will be .

But of course. Many batches of old people will be created during this period.

A simplifying model",https://twitter.com/temptempholder
2021-10-05 14:09:05+00:00,"All those people who die due to covid without having even have chance to get vaccine..  

Damn...

They will be sad that they were not given a chance to fight covid with vaccine status..

It's like going to war and giving your soldier tofu and tell them tofu is Ur weapon",https://twitter.com/temptempholder
2021-10-05 13:11:57+00:00,"Cheebye. Shit hit ceiling.

Alot of logistic to do. Thanks covid 19.

And now the waiting game.

As always prepare for the worst is the only thing we can do. https://t.co/xhuVGChNlf",https://twitter.com/temptempholder
2021-10-05 01:49:37+00:00,"I maintained my marriage by performing strictest lockdown like New Zealand.

But in the end, I have to let it go. 
I have decided to moved on from my marriage and lived with a girl called covid . https://t.co/CYbnUZF8BG",https://twitter.com/temptempholder
2021-10-04 14:58:43+00:00,"Who does not think they have a zero sum game with govt.
Instead, they help the govt when they see govt need help, like now covid!

Twitter is stuffed with former group though. Sadly. Full of self righteous people prancing around in their Calvin Klein underwear or bra acting holy.",https://twitter.com/temptempholder
2021-10-04 14:58:43+00:00,"Two types of Singaporean

Complain abt covid effort.

Vs

Dun complain about covid effort. Precisely they volunteer their help to help the govt to improve their service to the community.

Stay away from former group.
There are alot of compassionate Singaporean can do attitude who",https://twitter.com/temptempholder
2021-10-04 06:49:50+00:00,"People like gambling their life with covid as if their ego is so important, and as if they wisdom is real

You can be egoistic and over confident in many issue

But if u carry this attitude to covid

Then we are looking at some really dead meat soon in families broken up by covid https://t.co/ohEfHZWKZO",https://twitter.com/temptempholder
