date,renderedContent,user
2021-09-01 00:20:24+00:00,"Alot of people in Singapore now know that they have a chance to get covid now with Delta variant power.

Just that they think probability not high yet, they are not over 60, they are Vax.

So Singapore is now looking like this. Take Ur chance . https://t.co/a7Mff0SVVR",https://twitter.com/temptempholder
2021-09-01 00:09:49+00:00,"Then only good thing abt increasing cases and unlinked cases is that people who like to wait to vaccinate because covid numbers are low still so they can afford to wait still 

Will have reasons to vaccinate.

This will increase our vaccination climb daily now for this last group",https://twitter.com/temptempholder
2021-08-31 23:51:13+00:00,Maximum gear brought out. Maybe tuition in afternoon. Depends on iffy client. God bless me. Heavy bag today. My business may drop due to covid.. no guarantees. https://t.co/JfJ22ObWFN,https://twitter.com/temptempholder
2021-08-31 23:39:06+00:00,"Free though.

They have been working round the clock 100% for close to two years.

And they still are

Hopefully We will see flattening of hospitalisation , in particular, ICU, death despite rising covid cases which gives the best proof and mental boost that vaccine is right bet!",https://twitter.com/temptempholder
2021-08-31 23:39:04+00:00,"Personally tracing and quarantining seemed to be limited now. Things are changing to using technology to send health alerts to get tested.

Everything  about covid needs to change to automatic.

Usually public do heed govt, in this case Ong Ye Kun call for ownself reduce going",https://twitter.com/temptempholder
2021-08-31 23:25:26+00:00,"Looks good.
Also slept from 12-7am
After recent slow cheating my body to move to this time.
If not last time I sleep at 6am. Or 4am.

So last time I manage to do this feat is donkey years ago.
So its history being written again. 1 Sept 2021. Covid era.
youtu.be/kHmXaFXSFkE",https://twitter.com/temptempholder
2021-08-31 13:33:43+00:00,"And ours is opened local economy , allowing dine in for almost 20 days or so already.....

Basically.. people always will not think they family will have covid.

Until it hits them.

Right now.

200 daily.

Vs

5000000 population.

So it takes some times to randomly reach",https://twitter.com/temptempholder
2021-08-31 13:31:38+00:00,"Exponential.

Given that Malaysia hit 20 000 covid patients and more.

Having 70 plus unlinked for Singapore is only a matter of time.

We are considered very good already cos we test and trace like hell .

And it's been so long already that we keep number under wrap.",https://twitter.com/temptempholder
2021-08-30 14:15:23+00:00,"Why never mandate or give discount to make people learn hand signal classes.

No talk, all use signal is one good way to reduce covid spread! 

U dun need huge hand sign vocab to operate is daily uses.",https://twitter.com/temptempholder
2021-08-30 10:37:49+00:00,"The next question now for us is not ""have you gotten Vax?""

That is old question. We assume all have taken Vax Liao.

The next question is ""So have you gotten covid already? Did u go through it with no or minor side effect?"" https://t.co/vkXXGkHIEk",https://twitter.com/temptempholder
2021-08-27 15:41:46+00:00,"Remember, blood is in the hands of those Singaporean who keep talking about vaccinated people still get covid.. and keep harping that vaccinated people, a few die and they keep insist is caused by vaccine https://t.co/n5kGCAQ9HW",https://twitter.com/temptempholder
2021-08-27 11:27:43+00:00,"Covid-19: 3 F&amp;B outlets ordered shut for 10 days for not checking vaccination status of patrons, allowing unvaccinated diners todayonline.com/singapore/3-fb… via @TODAYonline",https://twitter.com/temptempholder
2021-08-27 07:15:59+00:00,"Covid screening and vaccine has same philosophy as MOH medical screening for Life since young programme.

We need to test test for all health problem and fixed when early.

I still in dinosaur era mindset though.

Younger people have luxury of being in new era.

I need to change",https://twitter.com/temptempholder
2021-08-27 03:18:20+00:00,"For comparing covid death of 60.

We can look at our daily suicide , which hovers around 1 .

Thus making up about 365 suicide death per year.

Total death is about 22 000.

Traffic death is about 88.

Cancer death is about 15 a day. So 5475 per year.

So far 88+5475+365+60=5988",https://twitter.com/temptempholder
2021-08-26 01:09:28+00:00,"25 August 12pm , Singapore. completed vaccination or received 1 dose for recovered covid patient

▓▓▓▓▓▓▓▓▓▓▓▓▓▓▓░░░░░ 78%",https://twitter.com/temptempholder
2021-08-24 15:28:34+00:00,"Everywhere I go.

Everywhere there is crowd to be honest.

Hence, confirm plus chop two weeks lag is over ..

With more relaxed rules also.

The covid number will shoot up.

Testing and containing is still sued by Govt.

The critical issue is still hospitalisation number",https://twitter.com/temptempholder
2021-08-24 15:23:26+00:00,"Endemic.

Dine in. Full of people craving for outside air and socialising at shops and food establishment.

Bugis junction mall now asking people to test for 17-24 Aug.

Hmm.... I at Fu Lu Shou side today. Abit near.

We are still trying to manage the covid numbers at this stage.",https://twitter.com/temptempholder
2021-08-24 08:06:59+00:00,No idea all these endless electronic how it is used. But covid has shown us that electronic product is a critical component of modern world. https://t.co/JRisjhVJ4h,https://twitter.com/temptempholder
2021-08-21 14:56:18+00:00,"Anti vaxxer Singaporean : Vaccine cam cause death. Govt not going to pay u if u die.

Me: waiting for these unVax Singaporean to get covid and need to get double lung transplant for their failing lung while I await for my Possible myocarditis or other long term side effect.",https://twitter.com/temptempholder
2021-08-21 04:31:14+00:00,"Just to see which country got more medals while people are still dying of covid. 

Plus all sports event, Euro cup, your school celebration, your family celebration what X anniversary.

What thing is not celebrating symbols.

If u want a lean world, then u be better a moral lean",https://twitter.com/temptempholder
2021-08-20 17:12:38+00:00,"Covid is nature , is viral particle, is a test that we humans are going to get it sooner or later.

It's weird to scold it. It's not even the uncle next door where if u scold it, it may solve the problem.

Learn from it. If u are alive . Be even stronger due to covid.",https://twitter.com/temptempholder
2021-08-20 01:54:56+00:00,Covid + flashflood https://t.co/6plq8COogb,https://twitter.com/temptempholder
2021-08-16 06:27:02+00:00,"After the KTV and Jurong fishery port cluster..

Every cluster like preschool one look damn noob liao..

Really is habituation is everything.

If ur country is used to dying 500 people everyday by covid. Like in some country.

Dying 20 people daily looks quite good news .",https://twitter.com/temptempholder
2021-08-12 15:10:54+00:00,"If u are not suffering from adverse effect of long covid or you have not been infected with covid yet

Its clear you have not even met with stage 1 boss fight yet.

You have seen nowhere near the worst case scenario.

Stop acting drama therefore .

Tracing, testing, making detour",https://twitter.com/temptempholder
2021-08-12 15:02:31+00:00,"Are sent to Thailand to build death railway or what.. most of us merely suffered minimal inconvienience.

Unless Ur family dies, otherwise this covid is very small issue and very fast over.

I do army 2 year 4 month of regular forest work then is call real hell.",https://twitter.com/temptempholder
2021-08-12 15:02:31+00:00,"Truth be said. 1 year and 7 months is very short period of time.

And so the covid issue even if we wait for another two months if will be gone in no time.

As long as your family and close friend is alive, it's actually forgettable experience.

It's not as if you all",https://twitter.com/temptempholder
2021-08-12 01:35:12+00:00,"It goes on..

As a math homework in probability...

Can u explain the probability of how many people will die due to non covid causes and die shortly after vaccinate by chance?

Its precisely question like this that we ask people to calculate what is the chance that",https://twitter.com/temptempholder
2021-08-12 01:35:11+00:00,"Are clearly seen to be no Lt related to covid like suicide or car accident.

So let's run some numbers first.

First day
12 000 out of 5 million go vaccinate.
60 people out of 5 million die.

Second day
12 000 out of 5 million go vaccinate.
60 people out of 5 million die.

And",https://twitter.com/temptempholder
2021-08-12 01:02:08+00:00,"Malaysians queuing with zero safety distancing cos desperate for vaccine.

Singapore forummers: Govt is pushing narrative of unvaccinate is cause of covid death.

These Singaporeans forumer is evil and shifting goalpost expert. They can spin their tales until they convince others",https://twitter.com/temptempholder
2021-08-11 16:52:03+00:00,"Even covid 19 virus will lose its viral effect one day.

Soon, we dun really want to hear covid stuff .

Just say some update every month.

We will return to other topics like the past.

We just need to know what govt wants us to do. And we will comply.

That's the way.",https://twitter.com/temptempholder
2021-08-11 14:08:09+00:00,"Another person with Joe Rogan type of attitude.

Siti Sarah husband

""Before my wife passed away, my maid passed away last Friday. Covid-19 is real. I used to be one of those who didn't believe in Covid-19 but then it happened to me,"" Mr Shahmira ,Facebook live video on Monday.",https://twitter.com/temptempholder
2021-08-08 15:26:30+00:00,"No country:
Literally no country:

Singapore: keeping it's cool despite dealing with covid 19 and not forgetting to remind Singaporean in cool way what is our Singapore Spirit.",https://twitter.com/temptempholder
2021-08-08 02:04:33+00:00,"In E Math , we have this things called compare the two standard deviation.

Compare the two interquartile range.

Or use the graph to interpret some question.

In essence, covid 19 all the statistics and graphs are what math education is trying to achieve, albeit  harder.",https://twitter.com/temptempholder
2021-08-07 18:10:55+00:00,"The Singaporean anti vaxxer can get all their freedom of dining in and not vaxxing themselves all they want

But they do not have luxury of

Having priority to ICU bed if they ever need one due to getting covid while unvaccinated

And they must pay ICU too cos we told them liao",https://twitter.com/temptempholder
2021-08-05 07:55:38+00:00,"Mr Donald McAvoy, 33, a bodybuilder known as Frue who manages a gym in Jacksonville, Florida, did not bother to get the Covid-19 vaccine because he thought the virus affected only older people with health problems.

But towards the end of June, he had a runny nose, which he",https://twitter.com/temptempholder
2021-07-30 07:04:11+00:00,"Seeing the female staff here explaining outside the shop the situation to another client 

Pls be my date.

Covid is changing the way how privacy and business is conducted

Privacy?? No privacy.. we the other clients can hear the details of this client issue if we pay attention",https://twitter.com/temptempholder
2021-07-30 06:49:11+00:00,Covid is such a butterfly effect!,https://twitter.com/temptempholder
2021-07-30 06:49:11+00:00,"Covid is game changer..

Never did I expect his errand I do..

The service here is entirely non face to face as much as possible ... Client outside the shop.. communicate using voice or video chat... 

Only when no choice then exchange will have a short face to face contact. Wow!",https://twitter.com/temptempholder
2021-07-19 09:19:53+00:00,"More details!!! 

Go go Singapore!!

Fear not. Go ride the rainbow and be the best Singaporean u can be!!

The fishery network is even more bigger!! 

As it is a high mode

KTV lounge and Jurong Fishery Port COVID-19 clusters are 'linked': Ong Ye Kung

channelnewsasia.com/news/singapore…",https://twitter.com/temptempholder
2021-07-19 07:07:38+00:00,"We test everything and we figure out clearly exactly why and where we want to test because we really want to learn about virus!

Even though we are vaccinating equally fast too!!..

Super proud of our Singapore government more and more!!

Been serious about covid since jan 2020!!",https://twitter.com/temptempholder
2021-07-19 05:30:56+00:00,"47000 cases per day. Surpassing Brazil, India.

Hence , global news media has said they are new epicenter.

Donation has been made by Singapore government periodically

In 18 July 2021. Singapore covid cases for local is experiencing its own high of 88 cases. 10 of which unlinked",https://twitter.com/temptempholder
2021-07-18 19:59:21+00:00,"Exponential in nature 

But against PAP govt..

These virus of covid 19 is still dumb in nature..

Just that they can do evolution fast..

Otherwise , it does not even have a purpose.. they are literally aimless.  They win by killing people they dun even have concept of celebrate",https://twitter.com/temptempholder
2021-07-18 19:39:51+00:00,"Those curious critics who demand covid information presented in certain way is damn irritating..

Think singapore will be worse off?? Because they never see these forumer powerful analysis??!!

Damn self worshipper fuckers.

Pls lah... There is already ton of information now.",https://twitter.com/temptempholder
2021-07-18 19:32:35+00:00,Home made pastry + daily report of covid https://t.co/pi8Q5s9N9z,https://twitter.com/temptempholder
2021-07-18 18:53:07+00:00,"Just use fraction to describe a message to a real life friend I know.

U are 1/2 dead now.

If got long covid , u will be 7/8 dead.",https://twitter.com/temptempholder
2021-07-18 18:36:09+00:00,I would go too faster than speed of light even after covid cluster shaming  if they send me this kind of picture. https://t.co/4aAeTvLjkx,https://twitter.com/temptempholder
2021-07-18 18:20:48+00:00,"To eat up by covid.

Then next eat up by neighbouring country who just 

""oops, accidentally swallowed this village. Just a village.. nothing to see world""",https://twitter.com/temptempholder
2021-07-18 18:20:47+00:00,"Official count for the covid cases is 

34 million. 34 000 000 . And now is 12 000 / days of covid tested.

Singaporean need to stop finding fault with govt abit

We literally has resources of some small village in China only!

If not for capacity built up by 60yr of PAP, we doom",https://twitter.com/temptempholder
2021-07-18 15:52:21+00:00,"There are really only two types of Singaporean individual in this covid reality.

One type is anti govt, critics who keep spinning stories to make it as if they are victim and creating conspiracy theory evidence against government

Another type is those Singaporean is who step up",https://twitter.com/temptempholder
2021-07-18 15:36:39+00:00,"Their stride. Ours cannot even be compared near to these war world 2 men.. not even close. 

Right now.. whatever courage u need now is just mere balls of chicken rice ball. 

So please just follow SIMPLE instructions of covid safety.
@WHO 

Lets trace let's test let's vaccinate! https://t.co/Flcx3wrbf0",https://twitter.com/temptempholder
2021-07-18 12:51:54+00:00,"Solution to covid 19.
Open Google Play.
Buy new movies and watch!

If no money, 
Download MediaCorp drama.
Watch Singapore drama to improve your comprehension skill",https://twitter.com/temptempholder
2021-07-18 12:50:55+00:00,"Talk about time lag
Incubation period.

We also need to therefore acknowledge this thing called

Stupidity lag

It takes 3 consecutive disaster before Singaporean brain realize what the covid ten years series book have been telling them since Day 1",https://twitter.com/temptempholder
2021-07-18 12:05:39+00:00,"Singaporeans should stop this : "" we want more assistance "" skit.

It's more than one year of covid.

You still dun want to redesign Ur work to be covid resilient.

Companies and individual can ask for help but should not be entitled to receive.",https://twitter.com/temptempholder
2021-07-18 11:31:01+00:00,"This one speak English one. So still a different breed form those speak Chinese elderly .

Your Say: As a senior, I was hesitant to get the Covid-19 vaccine. This was why I changed my mind
bit.ly/3rjUsm4

Download the TODAY app at todayonline.com/apps",https://twitter.com/temptempholder
2021-07-18 11:28:14+00:00,"But message from covid is loud and clear.

They will spread at almost everywhere and any situation.

It's nothing much to do with KTV cluster only.

So dun lie to ourselves by focusing on KTV.

It's everywhere now is of risk since we are currently doing all business open",https://twitter.com/temptempholder
2021-07-18 07:45:42+00:00,"Of that the whole Jurong  fish is main supplier to all markets and  is highly infected ..(this is supported by many market covid infected I think of live seafood , fish shops)

Govt will no doubt Shar emote light on rationale.

We should not complain.. and wait patiently.",https://twitter.com/temptempholder
2021-07-18 04:33:19+00:00,"The government is dealing with 100 interest at any one time..

And each one is waiting for their turn to strike .

With each business calculating and protecting and changing allies .

Today high end restaurant and KTV lup sup bars are enemies. Who know next year when covid may",https://twitter.com/temptempholder
2021-07-18 04:33:17+00:00,"My thoughts: I dun pity high end restaurant ones. Especially bosses whose profit goes mainly to them

It's a business calcuation u have to made during covid

S'pore's F&amp;B operators fear falling into a deeper hole with new Covid-19 restrictions on dining in
straitstimes.com/singapore/cons…",https://twitter.com/temptempholder
2021-07-18 04:19:35+00:00,"When is a joke acceptable?

If u made a joke about covid when people are dying in other country is it insensitive.

If u made a joke in general while other country is dying in masses, it is insensitive?

Who decides?

First mover?",https://twitter.com/temptempholder
2021-07-18 02:29:43+00:00,Such a good life advice and covid advice. https://t.co/Oo1wiD6iR0,https://twitter.com/temptempholder
2021-07-17 23:55:44+00:00,"Mexico covid death 236 000
Singapore covid death 36

Singaporean shit stirrer -
What is our govt doing to cover our lapses leading to outbreak and closure

Me : if we make covid got symptom once infected, they we can have no lapses!! 

Really Singapore anti govt pple unrealistic",https://twitter.com/temptempholder
2021-07-17 23:21:06+00:00,"People really think govt can see everything and stop everything.

They think utopia Sia.

Everything u can plan until no group suffer and no covid can ever outbreak 

Enforcement.
Regulation.

Please lah!

Do these anti govt forces actually know how governance and reality work?",https://twitter.com/temptempholder
2021-07-17 22:42:43+00:00,"Speaking, people get angry for the outbreak in Changi airport but it's related to job  and CECA which is also related to money but it does not have sex component.

With this covid KTV, there is both sex AND money component.

People who are sexually deprived are triggered.

People",https://twitter.com/temptempholder
2021-07-17 22:32:10+00:00,"Chaos during covid is best opportunity for spiritual awakening.

Without a reference meaning, your soul can finally unleash the full potential it has withheld from itself.",https://twitter.com/temptempholder
2021-07-17 21:31:35+00:00,"The country ability to handle covid squarely hinges on a strong handling of mathematical science.

Without a acute understanding of mathematical science,

You will not even know what numbers are important in first place...",https://twitter.com/temptempholder
2021-07-17 14:25:21+00:00,"If u need a better reason why inequality of all kinds is problematic for whole society from middle income view.

This covid period is the clear clear reason.

Not in my backyard syndrome is not a free lunch. 
Not my family, I dun care is also not a free lunch.

A society that",https://twitter.com/temptempholder
2021-07-17 14:16:50+00:00,"If Singaporean trust Singapore govt , things will be a much smoother process.

Feedback calmly, and never ever trigger the govt with your poorly researched conspiracy theory.

When govt can focus fully on covid and does not need to keep updating yall so often.

It will be smooth!",https://twitter.com/temptempholder
2021-07-17 14:13:42+00:00,"Singapore govt has experienced handling 1000 covid cases per day, just for some perspective.

Though context is different for this daily 60. 

It's worth nothing that Govt has the resolved to do whatever it takes to avoid tragic outcome experienced in most country.",https://twitter.com/temptempholder
2021-07-16 10:06:44+00:00,"Half of hospitalised Covid-19 patients suffered at least one complication: UK study
straitstimes.com/singapore/heal…",https://twitter.com/temptempholder
2021-07-15 18:56:10+00:00,"Here got covid or not. 
Like computer game Sia...

Life is a RPG.

Why my life game so lousy one..

I want to obtain my things.. find find still cannot get..
Damn Sia.. lousy game designer.. give me a lousy character..",https://twitter.com/temptempholder
2021-07-15 17:16:24+00:00,"Operation drone ART drop ship.

Who needs ART after going to KTV!

Hashtag here using secret code 

#123304316 (INEEDHELP)

And we will contact u for Ur address and use drone to deliver ART to Ur room so that at least u can test yourself over one week got covid or not!",https://twitter.com/temptempholder
2021-07-15 17:05:38+00:00,"govt mass testing for now still.. burning money!! Cos old people 70% Vax!!

Those refused vaccination ones.

It's really up to Ur choice!! Ur decision!!!

But we will pro PAP supporter cannot be held hijack by these people..

Because once old unvaccinated people death by covid",https://twitter.com/temptempholder
2021-07-15 11:45:57+00:00,"I myself is guilty of blaming learning point tutor few months ago for not seeing doctor.

But it's also not fair that I pin my blame squarely on her.

A few other tutors I know we're blaming her too..

The nature of things is that most of us lapse too... When it comes to covid",https://twitter.com/temptempholder
2021-07-15 11:35:14+00:00,"They expect govt can know exactly when the covid virus like to strike which cluster this time?

Govt got bionic eyes is it??

Hindsight complainers!!

Like that govt EVERYTHING  on the defensive loh!

Ask SIA eat grass for next one year.. u die is Ur business..we just steal",https://twitter.com/temptempholder
2021-07-15 06:19:28+00:00,"Reaching Potong Pasir Liao. Still early. Just nice walk inside on time and jab jab.

Die then die lah If I really turn out to be unlucky to tio heart inflammation, which itself dun cause death mostly and is recoverable.
Tio covid and die even more laughable right? https://t.co/GpEKSGgIT9",https://twitter.com/temptempholder
2021-07-15 06:14:13+00:00,"Shops at all times is it?
You will volunteer meh?

When covid now breaks at KTV, then we have to act nimbly to shift resources.

This is called resource optimisation. Endemic living.

Where is you all hindsight warrior when there is 0 and 1 daily covid case??

All hindsight",https://twitter.com/temptempholder
2021-07-15 06:14:12+00:00,"Station at blocks.

When covid develop at Bukit merah view market. We focus on attention for that issue and learn on the spot.

Govt will never have infinite resources . U think MOM company and staff how big? Size of Texas huh?

You think we can enforce at all types of",https://twitter.com/temptempholder
2021-07-15 06:14:12+00:00,"It's all same pattern.
We dun react when there is no cases at a certain place.

When covid appear at Changi airport. We act based on Changi airport issue.

When covid appear at Westgate we act based on it.

When covid appear at waste water of HDB block, we develop testing",https://twitter.com/temptempholder
2021-07-15 05:28:00+00:00,"Singapore govt has been consistently with police force catch catch catch.

But we all know that u cannot check all the shops all the time.

Other countries one even more lax because of their lack of rule of law.

So their covid even more rampant and wild spread.",https://twitter.com/temptempholder
2021-07-15 01:49:11+00:00,"Cor managing covid!

It should at least stabilise for these two weeks.

It will go up first before it goes down.

I think we should not over react lah.

I know people die they want clout now!! 

But seriously.. it only made it look bad on u. 

Only fellow idiot will share Ur",https://twitter.com/temptempholder
2021-07-15 01:49:10+00:00,"It depends on other factors too as the situation now and endemic mentality means we look primarily at severe cases , not covid number , as lockdown criteria.

So which is very hard to happen cos of our country ample resources and nimble options we have at our disposal",https://twitter.com/temptempholder
2021-07-15 01:33:25+00:00,"So far orchard road, beach road, Balestier , TOA payoh, Bugis-Little India (Middle Road) is related to KTV Vietnamese social hostess

So basically central Singapore. 

Is basically my area of concern for me

Damn!! 

Covid has shifted from Western Central to dead center central",https://twitter.com/temptempholder
2021-07-15 01:26:07+00:00,"And constant update 

U see other countries.. the mess is 10x or 50x cork up.

Singapore govt.. u all also hiam 

Really is hard to please.

A country which lock everything , unless u are natural resource rich, like New Zealand.. 

Usually can help with zero covid cases but",https://twitter.com/temptempholder
2021-07-15 00:11:40+00:00,"Is super duper huge issue overall.

America die close to few hundred thousand  people to covid they also just live on for those majority still alive.

Who really care about what Singapore ..

Let alone a tiny issue in Singapore with 50 new cases , and overall death of 30 plus",https://twitter.com/temptempholder
